{
  "id": "9d0e1f2a-3b4c-4d5e-6f7a-8b9c0d1e2f3a",
  "scheduled_email_id": "7f8a9b0c-1d2e-4f3a-5b6c-7d8e9f0a1b2c",
  "recipient_email": "marie.dubois@example.fr",
  "recipient_user_id": "a1b2c3d4-e5f6-4a7b-8c9d-0e1f2a3b4c5d",
  "subject": "Rappel: Formation du Faire ensemble - Niveau Initiation commence dans 2 jours",
  "delivery_status": "delivered",
  "sent_at": "2025-11-13T09:00:12Z",
  "delivered_at": "2025-11-13T09:00:45Z",
  "opened_at": "2025-11-13T10:15:22Z",
  "clicked_at": "2025-11-13T10:16:05Z",
  "bounced_at": null,
  "bounce_reason": null,
  "error_message": null,
  "provider_message_id": "msg_1A2B3C4D5E6F7G8H9I0J",
  "tenant_id": "1er-Degr√©",
  "created_at": "2025-11-13T09:00:12Z",
  "updated_at": "2025-11-13T10:16:05Z"
}
